{
  "schema_version": "routemind-policy-observation-v1",
  "run_id": "fixture-run-1",
  "scenario_id": "fixture-scenario-1",
  "decision_id": "decision-1",
  "request_id": "request-1",
  "tick": 4,
  "timestamp": null,
  "clock_domain": "SIMULATED",
  "previous_policy": "nearest",
  "selected_policy": "risk-aware",
  "switch_occurred": true,
  "switch_reason": "risk_pressure",
  "selection_mode": "deterministic",
  "policy_version": "1.0.0",
  "configuration_digest": "aaaaaaaaaaaaaaaaaaaaaaaaaaaaaaaaaaaaaaaaaaaaaaaaaaaaaaaaaaaaaaaa",
  "deterministic_seed": 7,
  "fallback_state": "NONE",
  "state": {"active_order_count": 3},
  "semantics": {"active_order_count": "DERIVED"},
  "consequences": [{"name": "assignment_changes", "status": "UNAVAILABLE", "value": null, "unit": "count", "provenance": null}],
  "provenance": {"reference_data_id": "travel:deterministic-local:v1"},
  "observation_semantics": "observational_association; not causal_switch_cost"
}
